{
  "schemaVersion": "1.0.0",
  "status": "passed",
  "profile": "auto",
  "effectiveProfile": "standard",
  "profileReason": "Nenhuma regra especial disparou; usando perfil standard.",
  "changedFiles": ["src/features/chat/components/ChatInput.tsx"],
  "gates": [
    {
      "name": "lint",
      "label": "Lint",
      "command": "npm run lint",
      "blocking": true,
      "status": "passed",
      "classification": "code",
      "durationMs": 1200,
      "exitCode": 0,
      "logPath": null,
      "details": ""
    }
  ],
  "escalations": {
    "reviewRequired": false,
    "securityRequired": false,
    "testerRecommended": true,
    "reasons": ["Componente visual alterado."]
  },
  "sessionDir": null,
  "summary": "1 passed"
}
